{"schema":"riffdb-agent-application-alpha-run/v2","run_id":"campaign03f-orders-rust-afabe6ab","bundle_hash":"18cacb2b44ce59fb4ff6c06ab0603c72a0cfba19829d6d2c4197e0c8ca123d71","package_distribution_checksums_sha256":"7c7fd88637bef6fbf7368d1b655f56ea23a7d4ba3b7b2353ff64b05e0da59274","package_installation_verified":true,"agent_identity":"codex-terra-campaign03f-orders-rust-afabe6ab","domain":"orders","language":"rust","independent":true,"fresh_context":true,"human_interventions":0,"identity_change_ceremony_count":1,"rescue_count":0,"kernel_attempts":0,"kernel_successes":0,"handwritten_glue_lines":0,"compiler_failures":2,"runtime_failures":0,"unsupported_shapes":[],"first_write_seconds":600,"time_to_first_committed_row_seconds":600,"first_page_read_seconds":601,"time_to_complete_seconds":660,"source_access":{"riffdb_implementation":false,"ticketdesk":false},"boundary_passed":true,"golden_passed":true,"rating":9.2,"explanation":"The public authoring loop supported a complete routed orders model, generated Rust bindings, typed idempotent command execution, and a verified fenced page read. Source-spanned compiler diagnostics made the two ordinary contract corrections direct. The sealed package build required an explicit offline Cargo source configuration, which was discoverable but added minor setup friction.","transcript_sha256":"efdf8c5fa7b08033f424a8f0a313213e5b9d98ae11987b1af7a12f9984d6b6c6"}
