{
  "schema": "riffdb-agent-application-alpha-run/v2",
  "run_id": "campaign04-blog-typescript-c442a2ac",
  "bundle_hash": "495c8b41d6a2182b749ab29c3ae555d5f5c2b6654ce54afc0dac1fed0e7d3988",
  "package_distribution_checksums_sha256": "df0b698fd95f6c95609ceb22eb4f96ca46478847f926ed0df02aa7bede0ccd39",
  "package_installation_verified": true,
  "agent_identity": "campaign04-agent-blog-typescript-c442a2ac",
  "domain": "blog",
  "language": "typescript",
  "independent": true,
  "fresh_context": true,
  "human_interventions": 0,
  "identity_change_ceremony_count": 1,
  "rescue_count": 0,
  "kernel_attempts": 0,
  "kernel_successes": 0,
  "handwritten_glue_lines": 0,
  "compiler_failures": 1,
  "runtime_failures": 0,
  "unsupported_shapes": [],
  "first_write_seconds": 336,
  "time_to_first_committed_row_seconds": 336,
  "first_page_read_seconds": 336,
  "time_to_complete_seconds": 999,
  "source_access": {
    "riffdb_implementation": false,
    "ticketdesk": false
  },
  "boundary_passed": true,
  "golden_passed": true,
  "rating": 9.5,
  "explanation": "Scaffolding a TypeScript web application with riffdb new and authoring the Blog/CMS contract and named RiffQL queries was straightforward using AUTHORING.md. One minor syntax diagnostic (RDB-S004 for missing comma between enum variants) pointed directly to the exact span and suggested inserting a comma. The generated TypeScript client provided complete end-to-end type safety, causal read-after-commit helpers, and zero handwritten transport glue.",
  "transcript_sha256": "7cf35e0c97b36e4d4d725a8333e598d730c49d45c5df077c3c994782eb79e384"
}
