{"schema":"riffdb-agent-application-alpha-run/v2","run_id":"campaign03u-blog-go-1aa9b6d8","bundle_hash":"fd40a910587ea545383824426e8a0313ed323a86f7146a3c3242809633a23ecf","package_distribution_checksums_sha256":"12513e9767461738d4a7be4deda0589b0d194e4e124871fd86a87fe65728023f","package_installation_verified":true,"agent_identity":"codex-terra-campaign03u-blog-go-1aa9b6d8","domain":"blog","language":"go","independent":true,"fresh_context":true,"human_interventions":0,"identity_change_ceremony_count":1,"rescue_count":0,"kernel_attempts":0,"kernel_successes":0,"handwritten_glue_lines":0,"compiler_failures":0,"runtime_failures":0,"unsupported_shapes":[],"first_write_seconds":600,"time_to_first_committed_row_seconds":600,"first_page_read_seconds":601,"time_to_complete_seconds":620,"source_access":{"riffdb_implementation":false,"ticketdesk":false},"boundary_passed":true,"golden_passed":true,"rating":9.4,"explanation":"The signed package-first Go path supported a bounded Blog/CMS with generated typed commands, exact named reads, a real HTTP detail page, and a generated non-replayed write followed by an exact fenced populated read. Public authoring diagnostics and the documented writable Go cache path were sufficient; no product guidance, kernel surface, source access, transport glue, or unresolved required shape was needed.","transcript_sha256":"d4d5f7e9f41fca34890fa625ad876a963a97b895793f8609725b54c41c956076"}
