{
  "schema": "riffdb-agent-application-alpha-run/v2",
  "run_id": "campaign04-blog-go-c442a2ac",
  "bundle_hash": "495c8b41d6a2182b749ab29c3ae555d5f5c2b6654ce54afc0dac1fed0e7d3988",
  "package_distribution_checksums_sha256": "df0b698fd95f6c95609ceb22eb4f96ca46478847f926ed0df02aa7bede0ccd39",
  "package_installation_verified": true,
  "agent_identity": "campaign04-agent-blog-go-c442a2ac",
  "domain": "blog",
  "language": "go",
  "independent": true,
  "fresh_context": true,
  "human_interventions": 0,
  "identity_change_ceremony_count": 1,
  "rescue_count": 0,
  "kernel_attempts": 0,
  "kernel_successes": 0,
  "handwritten_glue_lines": 0,
  "compiler_failures": 0,
  "runtime_failures": 0,
  "unsupported_shapes": [],
  "first_write_seconds": 516,
  "time_to_first_committed_row_seconds": 516,
  "first_page_read_seconds": 516,
  "time_to_complete_seconds": 536,
  "source_access": {
    "riffdb_implementation": false,
    "ticketdesk": false
  },
  "boundary_passed": true,
  "golden_passed": true,
  "rating": 9.6,
  "explanation": "Building the Blog/CMS application in Go from an empty repository was seamless. The generated AUTHORING.md and Go SDK documentation clearly explained aggregate routing, relationship proofs, primary-key slug route modeling, dependent tag hydration, and read-after-commit fencing. The source-only check and explicit lock ceremony compiled the contract, four RiffQL queries, role, and Go bindings on the first attempt with zero compiler or runtime errors, and the generated Go client required zero handwritten transport or codec glue.",
  "transcript_sha256": "2bfa4bfff3ffc215a50b1a9c11dfc88af003288a6e664d23710709086d1fd81c"
}
